Event Num,Event Title,Article Set,Selected Article,Stakeholder,Giver,Receiver,Problematic Behavior,Aftermath,Platform,Link,Unnamed: 11,Unnamed: 12,Unnamed: 13,Unnamed: 14,비고
50152,Chief economic advisor's Twitter account gets hacked,"('Chief economic advisor's Twitter account gets hacked', 'the hindustan times', '2016-10-18')",Chief economic advisor’s Twitter account gets hacked,n-r->1-i,n-r,1-i,Scaled Abuse_Hacking,,Twitter,https://www.hindustantimes.com/nation-newspaper/chief-economic-advisor-s-twitter-account-gets-hacked/story-SftmO6yAOAxNjwOtfwqqBP.html,n-r은 해커에 대한 정보가 전혀 없어서 n-r 처리. / 1-i: Chief economic advisor Arvind Subramanian,,,,
15241,Govts break Internet to stay on in power',"(Arrest Made In Attack That Slowed The Internet, new york times, 2013-04-27)",Dutch Man Said to Be Held in Powerful Internet Attack,1-r->1-i,1-r,1-i,Scaled Abuse_Hacking,Legal Action,Online,https://www.nytimes.com/2013/04/27/technology/dutch-man-said-to-be-arrested-in-powerful-internet-attack.html,,,,,
35834,Ayli Ghiya's Instagram account hacked; threatening messages sent to followers,"('Ayli Ghiya's Instagram account hacked; threatening messages sent to followers', 'the times of india', '2020-08-17')",Exclusive: Ayli Ghiya's Instagram account hacked; vulgar messages sent to followers,n-r->1-i,n-r,1-i,Scaled Abuse_Hacking,,Instagram,https://timesofindia.indiatimes.com/entertainment/marathi/movies/news/exclusive-ayli-ghiyas-instagram-account-hacked-vulgar-messages-sent-to-followers/articleshow/77576078.cms,,,,,
,,"(Experts fear an age of mobile viruses, 2005)",Experts fear an age of mobile viruses,1-r->n-r,1-r,n-r,Scaled Abuse_Malware,,Online,,,,,,
65662,Is a history textbook full of 'sugar-coated lies' because it celebrates minorities? (Posted 2016-03-11 18:36:52),"('Is a history textbook full of 'sugar-coated lies' because it celebrates minorities? (Posted 2016-03-11 18:36:52)', 'the washington post', '2016-01-01')","Facebook gives $1,000 in ad credits for counter terror propaganda",1-i->S,1-i,S,Scaled Abuse_Inauthentic Behavior,Protective Measures,Facebook,,"테러 선전을 방지하는 데 기여한 사용자들에게 최대 1,000달러 상당의 광고 크레딧을 제공",,,,
14556,Facebook Says Hackers Breached Its Computers,"('Facebook Says Hackers Breached Its Computers', 'new york times', '2013-02-15')",Facebook Says Hackers Breached Its Computers,n-r->S,n-r,S,Scaled Abuse_Hacking,,Facebook,https://archive.nytimes.com/bits.blogs.nytimes.com/2013/02/15/facebook-admits-it-was-hacked/,,,,,
35933,Social media users outraged over Afghan migrant burning in Iran,"(Fake Facebook accounts mar debate on Philippine anti-terror bill, dpa international (english), 2020-06-07)",Fake Facebook accounts mar debate on Philippine anti-terror bill,n-r->n-r,n-r,n-r,Scaled Abuse_Inauthentic Behavior,Protective Measures,Facebook,https://www.thestar.com.my/aseanplus/aseanplus-news/2020/06/07/fake-facebook-accounts-mar-debate-on-philippine-anti-terror-bill#goog_rewarded,,,,,
43719,Ukraine pro-Russian group slams Facebook for blocking,"('Ukraine pro-Russian group slams Facebook for blocking', 'bbc monitoring former soviet union', '2017-01-24')","In French Elections, Alt-Right Messages and Memes Don‚Äôt Translate",n-i->n-r,n-i,n-r,Scaled Abuse_Inauthentic Behavior,,4chan,,,,,,
47402,Ashley Madison hackers release vast database of 33m accounts,"(U.S. News: IRS Boosts Estimate of Accounts Hacked, wall street journal, 2015-08-19)",IRS Says Cyberattacks More Extensive Than Previously Reported,n-r->n-r,n-r,n-r,Scaled Abuse_Hacking,,Get Transcript,https://www.wsj.com/articles/irs-says-cyberattacks-more-extensive-than-previously-reported-1439834639,Get Transcript는 해킹이 일어난 플랫폼(online app.),n-r->n-r이나 앞의 n-r은 Government investigators previously said they believe many of the attacks came from criminals operating in Russia as well as other countries. They didn’t elaborate Monday on who they think was behind the attacks. 이고 뒤의 n-r은 개인정보 유출 피해 납세자(일반인)으로 둘이 다름.,,,
22512,LinkedIn Pages That Promise Prurient Pics Link to Malware,"('LinkedIn Pages That Promise Prurient Pics Link to Malware', 'computerworld', '2009-01-12')",LinkedIn pages that promise prurient pics link to malware,n-r->n-r,n-r,n-r,Scaled Abuse_Malware,,LinkedIn,https://www.computerworld.com/article/1710092/linkedin-pages-that-promise-prurient-pics-link-to-malware.html?utm=hybrid_search,,,,,
,,"(Online: Incredible bulk: Danny O'Brien mingles among the arch spammers and explains the new ways to track down serial offenders, 2004)",Online: Incredible bulk: Danny O'Brien mingles among the arch spammers and explains the new ways to track down serial offenders,n-r->n-r,n-r,n-r,Scaled Abuse_Spam,Legal Action,Online,,이메일로 다량의 스팸 메일 전송,,,,
1542,Several groups banned by Facebook had strong similarities to Twitter accounts linked to Russia six weeks ago,"('Several groups banned by Facebook had strong similarities to Twitter accounts linked to Russia six weeks ago', 'the washington post', '2018-08-04')",Several groups banned by Facebook had strong similarities to Twitter accounts linked to Russia six weeks ago,1-i->n-r,1-i,n-r,Scaled Abuse_Inauthentic Behavior,Platform Ban,Facebook,https://www.washingtonpost.com/technology/2018/08/04/several-groups-banned-by-facebook-had-strong-similarities-twitter-accounts-linked-russia-six-weeks-ago/,페이스북이 차단한 것 vs 차단 당한 집단이 차단 당한 짓(문제 행동)을 한 것,,,,
4526,Tech giants face big test in midterms as they work to stamp out fake accounts,"('Tech giants face big test in midterms as they work to stamp out fake accounts', 'the washington post', '2018-10-09')",The Daily 202: Technology giants face big test in midterm elections,n-r->n-r,n-r,n-r,Scaled Abuse_Inauthentic Behavior,Platform Ban,"Facebook, Twitter, Google",https://www.washingtonpost.com/news/powerpost/paloma/daily-202/2018/10/08/daily-202-technology-giants-face-big-test-in-midterm-elections/5bba75ea1b326b7c8a8d1886/,Google에서 영상을 삭제했다는 표현 -> 유튜브라고 추론 가능하나 유튜브 명시는 X.,Platform Ban이 platform에서의 ban VS platform이 ban을 당함,Fake account -> Scaled Abuse_Inauthentic Behavior 이걸로 보는 게 나을지. (Disinfo 언급도 명백히 있음),,
19483,50% of Internet users had their data leaked,"('50% of Internet users had their data leaked', 'the korea times', '2011-04-19')",Twitter hackers spread Ground Zero attack scare before account suspension,n-r->1-i,n-r,1-i,Scaled Abuse_Inauthentic Behavior,"Misinformation led to action, Address Misinformation",Twitter,https://www.theguardian.com/world/2011/sep/10/twitter-hackers-ground-zero-scare,,,,,
22395,,"(Twitter shut as hackers bombard it with spam, 2009)",Twitter shut as hackers bombard it with spam,n-r->S,n-r,S,Scaled Abuse_Spam,,Twitter,,,,,,
38708,U.S. News: Twitter Suspends Some Bloomberg Backers,"('U.S. News: Twitter Suspends Some Bloomberg Backers', 'wall street journal', '2020-02-24')",Twitter Suspends Some Accounts Backing Michael Bloomberg,n-r->n-r,n-r,n-r,Scaled Abuse_Inauthentic Behavior,Remove Content,Twitter,https://www.wsj.com/articles/twitter-suspends-some-accounts-backing-michael-bloomberg-11582404989,"A Twitter spokeswoman Saturday said it suspended the accounts for violating its rules against platform manipulation and spam, such as efforts to artificially boost messages on the company’s platform. + Twitter’s rules prohibit “coordinating with or compensating others to engage in artificial engagement or amplification, even if the people involved use only one account.”",,,,