Event Num,Event Title,Article Set,Selected Article,Stakeholder,Giver,Receiver,Problematic Behavior,Aftermath,Platform,Link,Unnamed: 11,Unnamed: 12,Unnamed: 13,Unnamed: 14,비고
10851,"GodMode' access is still a problem at Twitter, another whistleblower alleges","(''GodMode' access is still a problem at Twitter, another whistleblower alleges', 'the washington post', '2023-01-24')","(''GodMode' access is still a problem at Twitter, another whistleblower alleges', 'the washington post', '2023-01-24')",S->n-r,S,n-r,Scaled Abuse_Hacking,Whistleblow,Twitter,https://www.washingtonpost.com/politics/2023/01/24/godmode-access-is-still-problem-twitter-another-whistleblower-alleges/,트위터 godmode의 악용,,,,
30179,‘I can’t be that careless’: Australian Uyghur activist targeted online,"('‘I can’t be that careless’: Australian Uyghur activist targeted online', 'the guardian', '2021-05-15')","('‘I can’t be that careless’: Australian Uyghur activist targeted online', 'the guardian', '2021-05-15')",n-r->1-r,n-r,1-r,Scaled Abuse_Malware,Protective Measures,Facebook,https://www.theguardian.com/world/2021/may/16/i-cant-be-that-careless-australian-uyghur-activist-targeted-online,,,,,"가짜 계정으로 링크 열게 해서, 랜섬웨어 설치 -> 이에 대한 보호 조치 사용"
53885,Our pain for their gain': the American activists manipulated by Russian trolls,"(''Our pain for their gain': the American activists manipulated by Russian trolls', 'the guardian', '2017-10-21')","(''Our pain for their gain': the American activists manipulated by Russian trolls', 'the guardian', '2017-10-21')",n-i->n-r,n-i,n-r,Scaled Abuse_Inauthentic Behavior,Misinformation leg to action,Facebook,https://www.theguardian.com/world/2017/oct/21/russia-social-media-activism-blacktivist,,,,,
7930,"‘Troll factory’ spreading Russian pro-war lies online, says UK","('‘Troll factory’ spreading Russian pro-war lies online, says UK', 'the guardian', '2022-05-03')","('‘Troll factory’ spreading Russian pro-war lies online, says UK', 'the guardian', '2022-05-03')",n-r->n-r,n-r,n-r,Scaled Abuse_Inauthentic Behavior,,Twitter,https://www.theguardian.com/world/2022/may/01/troll-factory-spreading-russian-pro-war-lies-online-says-uk,using bot for disinformation,,,,
54967,An army of fake Twitter accounts invades Ireland. What is their purpose?,"('An army of fake Twitter accounts invades Ireland. What is their purpose?', 'irish times', '2017-10-28')","('An army of fake Twitter accounts invades Ireland. What is their purpose?', 'irish times', '2017-10-28')",n-r->1-r,n-r,1-r,Scaled Abuse_Inauthentic Behavior,Protective Measures,Twitter,https://www.irishtimes.com/culture/tv-radio-web/an-army-of-fake-twitter-accounts-invades-ireland-why-1.3271340,,,,,
52743,Baijal's Twitter account hacked,"('Baijal's Twitter account hacked', 'the times of india', '2018-02-28')","('Baijal's Twitter account hacked', 'the times of india', '2018-02-28')",1-r->1-i,1-r,1-i,Scaled Abuse_Hacking,,Twitter,https://economictimes.indiatimes.com/news/politics-and-nation/delhi-lg-anil-baijals-twitter-handle-hacked-official/articleshow/63101502.cms?from=mdr,,,,,
17129,Be wary of buying Facebook 'friends',"('Be wary of buying Facebook 'friends'', 'the washington post', '2012-03-05')","('Be wary of buying Facebook 'friends'', 'the washington post', '2012-03-05')",S->1-i,S,1-i,Scaled Abuse_Inauthentic Behavior,,Facebook,https://www.washingtonpost.com/business/on-small-business/buying-facebook-friends-should-you-do-it/2012/02/23/gIQA1cJtgR_story.html,좋아요 구매,,,,
2046,"Bots of the Internet, Reveal Yourselves!","('Bots of the Internet, Reveal Yourselves!', 'new york times', '2018-07-16')","('Bots of the Internet, Reveal Yourselves!', 'new york times', '2018-07-16')",n-r->S,n-r,S,Scaled Abuse_Inauthentic Behavior,"Protective Measures, Legal Action",Twitter,https://www.nytimes.com/2018/07/16/style/how-to-regulate-bots.html,자동화 봇 이야기가 점점 많아짐,,,,
40160,Can Social Media Alter a War? A 2019 experiment exploited Facebook and Instagram to manipulate soldiers.,"('Can Social Media Alter a War? A 2019 experiment exploited Facebook and Instagram to manipulate soldiers.', 'wall street journal', '2022-01-02')","('Can Social Media Alter a War? A 2019 experiment exploited Facebook and Instagram to manipulate soldiers.', 'wall street journal', '2022-01-02')",n-r->n-r,n-r,n-r,Scaled Abuse_Inauthentic Behavior,Manipulate Behavior,"Facebook, Instagram",https://www.wsj.com/opinion/can-social-media-alter-a-war-nato-russian-bots-colonial-pipeline-national-security-ukraine-cyberwarfare-hack-invasion-11641130267,,,,,
9514,"China Extends Military Exercises as Taiwan Battles Cyberattacks; University websites and 7-Eleven stores have been affected, in some cases to hurl insults at U.S. House Speaker Nancy Pelosi","('China Extends Military Exercises as Taiwan Battles Cyberattacks; University websites and 7-Eleven stores have been affected, in some cases to hurl insults at U.S. House Speaker Nancy Pelosi', 'wall street journal', '2022-08-08')","('China Extends Military Exercises as Taiwan Battles Cyberattacks; University websites and 7-Eleven stores have been affected, in some cases to hurl insults at U.S. House Speaker Nancy Pelosi', 'wall street journal', '2022-08-08')",1-i->1-i,1-i,1-i,Scaled Abuse_Hacking,,Online,https://www.wsj.com/world/china/china-extends-military-exercises-as-taiwan-battles-cyberattacks-11659969484,"사이버 대전 (중국, 대만)",,,,
7518,Ex-Bigg Boss contestant Somi Khan's Instagram hacked,"('Ex-Bigg Boss contestant Somi Khan's Instagram hacked', 'the times of india', '2019-03-05')","('Ex-Bigg Boss contestant Somi Khan's Instagram hacked', 'the times of india', '2019-03-05')",1-r->1-i,1-r,1-i,Scaled Abuse_Hacking,Legal Action,Instagram,https://timesofindia.indiatimes.com/tv/news/hindi/ex-bigg-boss-contestant-somis-instagram-hacked/articleshow/68253817.cms,,,,,
7022,Facebook fait le ménage dans des faux comptes en Europe de l'Est,"('Facebook fait le ménage dans des faux comptes en Europe de l'Est', 'le monde', '2019-01-18')","('Facebook fait le ménage dans des faux comptes en Europe de l'Est', 'le monde', '2019-01-18')",n-r->n-r,n-r,n-r,Scaled Abuse_Inauthentic Behavior,Platform Ban,Facebook,https://www.lesechos.fr/tech-medias/medias/facebook-fait-le-menage-parmi-des-faux-comptes-lies-a-la-russie-593426,Astroturfing이라는 단어가 가장 적합한 내용이라는 생각,,,,
60448,Facebook Says India Users Not Hit by Hacking Attack,"('Facebook Says India Users Not Hit by Hacking Attack', 'wall street journal', '2011-11-17')","('Facebook Says India Users Not Hit by Hacking Attack', 'wall street journal', '2011-11-17')",S->n-r,S,n-r,Scaled Abuse_Spam,,Facebook,https://www.marketwatch.com/story/facebook-says-india-users-not-hit-by-hacking-2011-11-17-51860,,,,,
50447,Foreign Facebook love revives Cambodian PM 'click farm' row,"('Foreign Facebook love revives Cambodian PM 'click farm' row', 'the nation', '2016-08-09')","('Foreign Facebook love revives Cambodian PM 'click farm' row', 'the nation', '2016-08-09')",1-i->n-r,1-i,n-r,Scaled Abuse_Inauthentic Behavior,,Facebook,https://www.nationthailand.com/in-focus/30292518,좋아요 구매,,,,
52268,"Forgetting events is part of the way we create memories. It also explains the Facebook crisis, Putin and Trump.","('Forgetting events is part of the way we create memories. It also explains the Facebook crisis, Putin and Trump.', 'chicago tribune', '2018-04-06')","('Forgetting events is part of the way we create memories. It also explains the Facebook crisis, Putin and Trump.', 'chicago tribune', '2018-04-06')",1-i->n-i,1-i,n-i,Scaled Abuse_Spam,Protective Measures,Facebook ,https://www.chicagotribune.com/2018/04/06/forgetting-events-is-part-of-the-way-we-create-memories-it-also-explains-the-facebook-crisis-putin-and-trump/,정치당이 정치인들 이메일 해킹,언젠가 다시 읽어보기,,,
40290,How to Keep the Rising Tide of Fake News From Drowning Our Democracy,"('How to Keep the Rising Tide of Fake News From Drowning Our Democracy', 'new york times', '2022-03-07')","('How to Keep the Rising Tide of Fake News From Drowning Our Democracy', 'new york times', '2022-03-07')",n-r->n-r,n-r,n-r,Scaled Abuse_Inauthentic Behavior,Protective Measures,Social Media,https://www.nytimes.com/2022/03/07/opinion/cheap-speech-fake-news-democracy.html,disinformation label,,,,
42927,Howard cancels another day of online and hybrid classes as officials investigate alleged cyberattack,"('Howard cancels another day of online and hybrid classes as officials investigate alleged cyberattack', 'the washington post', '2021-09-08')","('Howard cancels another day of online and hybrid classes as officials investigate alleged cyberattack', 'the washington post', '2021-09-08')",n-r->n-r,n-r,n-r,Scaled Abuse_Malware,,Online,https://www.washingtonpost.com/education/2021/09/08/howard-university-ransomware-cyberattack/,,랜섬웨어 공격자 (불특정) → 하워드 대학 전체 학생 및 교직원,,랜섬웨어 사이버 공격,
52322,Israeli Intelligence Firm's Election-Meddling Analysis Comes Under Mueller's Scrutiny; Psy-Group presentation outlines ways Trump campaign was helped by fake social media accounts,"('Israeli Intelligence Firm's Election-Meddling Analysis Comes Under Mueller's Scrutiny; Psy-Group presentation outlines ways Trump campaign was helped by fake social media accounts', 'wall street journal', '2018-05-25')","('Israeli Intelligence Firm's Election-Meddling Analysis Comes Under Mueller's Scrutiny; Psy-Group presentation outlines ways Trump campaign was helped by fake social media accounts', 'wall street journal', '2018-05-25')",n-r->n-r,n-r,n-r,Scaled Abuse_Inauthentic Behavior,,Facebook,https://www.wsj.com/articles/israeli-intelligence-firms-election-meddling-analysis-comes-under-muellers-scrutiny-1527288767,페이스북 가짜봇,,,,
35776,Kasautii Zindagii Kay's Mohini Basu aka Shubhaavi Choksey's Instagram account gets hacked; Hina Khan warns her followers,"('Kasautii Zindagii Kay's Mohini Basu aka Shubhaavi Choksey's Instagram account gets hacked; Hina Khan warns her followers', 'the times of india', '2020-08-01')","('Kasautii Zindagii Kay's Mohini Basu aka Shubhaavi Choksey's Instagram account gets hacked; Hina Khan warns her followers', 'the times of india', '2020-08-01')",1-r->1-i,1-r,1-i,Scaled Abuse_Hacking,Protective Measures,Instagram,https://timesofindia.indiatimes.com/tv/news/hindi/kasautii-zindagii-kays-mohini-basu-aka-shubhaavi-chokseys-instagram-account-gets-hacked-hina-khan-warns-her-followers/articleshow/77280869.cms,,,,,
40403,Li Nanxing's Instagram account hacked by swindlers,"('Li Nanxing's Instagram account hacked by swindlers', 'the straits times', '2022-01-20')","('Li Nanxing's Instagram account hacked by swindlers', 'the straits times', '2022-01-20')",1-r->1-i,1-r,1-i,Scaled Abuse_Hacking,Fraud,Instagram,https://www.straitstimes.com/life/entertainment/li-nanxings-instagram-account-hacked-by-swindlers,,,,,
17251,"Anonymous hacks BJP websites, wants people to protest against 'web censorship'","('Likejacking': Spammers Hit Social Media, bloomberg businessweek, 2012-05-28)","('Likejacking': Spammers Hit Social Media, bloomberg businessweek, 2012-05-28)",n-r->n-r,n-r,n-r,Scaled Abuse_Spam,,Pinterest,https://www.bloomberg.com/news/articles/2012-05-24/likejacking-spammers-hit-social-media,,,,,
61006,Media: Tools of the trade: Anti-SMS-spam,"('Media: Tools of the trade: Anti-SMS-spam', 'the guardian', '2009-06-29')","('Media: Tools of the trade: Anti-SMS-spam', 'the guardian', '2009-06-29')",n-r->n-r,n-r,n-r,Scaled Abuse_Spam,,Message,https://www.theguardian.com/media/2009/jun/29/avoid-sms-spam-advice,,,,,
10916,Miscreants hack FB account of transgender board V-C,"('Miscreants hack FB account of transgender board V-C', 'the times of india', '2023-03-05')","('Miscreants hack FB account of transgender board V-C', 'the times of india', '2023-03-05')",n-r->1-i,n-r,1-i,Scaled Abuse_Hacking,Legal Action,Facebook,https://timesofindia.indiatimes.com/city/lucknow/miscreants-hack-fb-account-of-transgender-board-v-c/articleshow/98421039.cms,,,,,
22704,More E-Mail Account Details Leaked Online,"('More E-Mail Account Details Leaked Online', 'new york times', '2009-10-06')","('More E-Mail Account Details Leaked Online', 'new york times', '2009-10-06')",n-r->n-r,n-r,n-r,Scaled Abuse_Malware,,Hotmail,https://archive.nytimes.com/gadgetwise.blogs.nytimes.com/2009/10/06/more-e-mail-account-details-leaked-online/,,,,,
39822,Spot the bot: AI-generated fake reviews flooding the internet prove difficult to detect,"('Spot the bot: AI-generated fake reviews flooding the internet prove difficult to detect', 'irish examiner', '2023-07-15')","('Spot the bot: AI-generated fake reviews flooding the internet prove difficult to detect', 'irish examiner', '2023-07-15')",n-r->n-r,n-r,n-r,Scaled Abuse_Inauthentic Behavior,Social Media Policy Change,Online,https://www.irishexaminer.com/opinion/commentanalysis/arid-41184352.html,chatgpt 리뷰 대량생산,,,,
65479,"Thai hacktivists targeting government websites arrested, junta says","('Thai hacktivists targeting government websites arrested, junta says', 'dpa international (english)', '2016-12-26')","('Thai hacktivists targeting government websites arrested, junta says', 'dpa international (english)', '2016-12-26')",1-r->1-i,1-r,1-i,Scaled Abuse_Malware,Legal Action,Online,https://www.newvision.co.ug/news/1442831/thailand-detains-hacks-protesting-cyber-law,,,,,
15921,"Today’s Scuttlebot: Confessions of a Fake Web Traffic Buyer, and the False Promise of Classroom Technology","('Today’s Scuttlebot: Confessions of a Fake Web Traffic Buyer, and the False Promise of Classroom Technology', 'new york times', '2013-11-12')","('Today’s Scuttlebot: Confessions of a Fake Web Traffic Buyer, and the False Promise of Classroom Technology', 'new york times', '2013-11-12')",1-i->n-r,1-i,n-r,Scaled Abuse_Inauthentic Behavior,,Online,https://archive.nytimes.com/bits.blogs.nytimes.com/2013/11/12/todays-scuttlebot-confessions-of-a-fake-web-traffic-buyer-and-the-false-promise-of-classroom-technology/,,,,,
29072,Video shows how to hack emergency alert system to send fake terror threats,"('Video shows how to hack emergency alert system to send fake terror threats', 'the daily telegraph', '2023-04-22')","('Video shows how to hack emergency alert system to send fake terror threats', 'the daily telegraph', '2023-04-22')",1-i->1-i,1-i,1-i,Scaled Abuse_Hacking,,Youtube,https://www.telegraph.co.uk/politics/2023/04/21/hackers-fake-terror-threats-youtube/,유튜브에 해킹 방법 업로드,,,,
49017,What happens when most of China visits your website? It dies a horrible death,"('What happens when most of China visits your website? It dies a horrible death', 'the guardian', '2015-01-23')","('What happens when most of China visits your website? It dies a horrible death', 'the guardian', '2015-01-23')",n-r->S,n-r,S,Scaled Abuse_Spam,,Iconfactory,https://www.theguardian.com/technology/2015/jan/23/what-happens-when-most-of-china-visits-your-website-it-dies-a-horrible-death,,,,,
20464,"With money moving hands, online crime comes of age","('With money moving hands, online crime comes of age', 'the times of india', '2011-08-23')","('With money moving hands, online crime comes of age', 'the times of india', '2011-08-23')",n-r->1-i,n-r,1-i,Scaled Abuse_Malware,,Online,https://timesofindia.indiatimes.com/city/mumbai/with-money-moving-hands-online-crime-comes-of-age/articleshow/9690938.cms,,,,,
3150,"Your country needs you to fight fake news, UK journalists told","('Your country needs you to fight fake news, UK journalists told', 'the guardian', '2018-05-01')","('Your country needs you to fight fake news, UK journalists told', 'the guardian', '2018-05-01')",n-r->n-r,n-r,n-r,Scaled Abuse_Inauthentic Behavior,Social Media Policy Change,Online,https://www.theguardian.com/politics/2018/may/01/your-country-needs-you-to-fight-fake-news-uk-journalists-told,,,,,
9877,How long will Twitter stand by as ‘online violence’ curtails our right to know?,"(Army's YouTube and Twitter sites 'breached', the daily telegraph, 2022-07-04)","(Army's YouTube and Twitter sites 'breached', the daily telegraph, 2022-07-04)",n-r->1-i,n-r,1-i,Scaled Abuse_Hacking,,"Twitter, Youtube",https://www.telegraph.co.uk/news/2022/07/03/british-army-hit-cyberattack-twitter-youtube-accounts-hacked/,군대 공식 유툽/트위터 해킹,,,,
59356,Chinese hackers outed themselves by logging into their personal Facebook accounts (Posted 2013-02-19 19:02:56),"(Chinese hackers outed themselves by logging into their personal Facebook accounts (Posted 2013-02-19 19:35:16), the washington post, 2013-01-01), (Chinese hackers outed themselves by logging into their personal Facebook accounts (Posted 2013-02-19 20:11:23), the washington post, 2013-01-01)","(Chinese hackers outed themselves by logging into their personal Facebook accounts (Posted 2013-02-19 19:35:16), the washington post, 2013-01-01)",n-r->n-r,n-r,n-r,Scaled Abuse_Hacking,,Online,https://www.washingtonpost.com/news/worldviews/wp/2013/02/19/chinese-hackers-outed-themselves-by-logging-into-their-personal-facebook-accounts/,,,,,
9864,"Disneyland's social media hacked with racist, insensitive posts","(Disneyland's Instagram Account Hacked With a Series of Profane, Racist Posts; 'We worked quickly to remove the reprehensible content,' a Disneyland representative said, wall street journal, 2022-07-07), (CITY &amp; STATE; Disneyland's social media hacked with anti-gay and racist posts, los angeles times, 2022-07-08)","(Disneyland's Instagram Account Hacked With a Series of Profane, Racist Posts; 'We worked quickly to remove the reprehensible content,' a Disneyland representative said, wall street journal, 2022-07-07)",1-r->1-i,1-r,1-i,Scaled Abuse_Hacking,Protective Measures,Instagram,https://www.wsj.com/business/media/disneylands-instagram-account-hacked-with-a-series-of-profane-racist-posts-11657213488,,,,,
36815,When Facebook Politics Get Extra Personal,"(Down the rabbit hole: how QAnon conspiracies thrive on Facebook, the guardian, 2020-06-25)","(Down the rabbit hole: how QAnon conspiracies thrive on Facebook, the guardian, 2020-06-25)",1-i->n-r,1-i,n-r,Scaled Abuse_Inauthentic Behavior,Protective Measures,Facebook,https://www.theguardian.com/technology/2020/jun/25/qanon-facebook-conspiracy-theories-algorithm,,,,,
8622,Police raid homes throughout Europe to combat online hate crime,"(Belarus 'propagandist' banned from Facebook for hate speech, bbc monitoring former soviet union, 2022-04-09), (Facebook cracks down on covert influence networks targeting Ukraine, the washington post, 2022-04-08), (Pro-Russian tweets a sign of influence campaign: Think-tank, the straits times, 2022-04-08), (Galloway's Twitter marked as Kremlin propaganda, the daily telegraph, 2022-04-07)","(Facebook cracks down on covert influence networks targeting Ukraine, the washington post, 2022-04-08)",n-r->S,n-r,S,Scaled Abuse_Inauthentic Behavior,Social Media Policy Change,Facebook,https://www.washingtonpost.com/technology/2022/04/07/facebook-covert-influence-ukraine/,"허위신고, 음모론 등의 문제 해결을 위해 페이스북 보호 조치 시행",,,,
46966,One held for creating woman's fake FB profile,"(FIA busts gang hacking girls Facebook accounts, the nation, 2015-10-14)","(FIA busts gang hacking girls Facebook accounts, the nation, 2015-10-14)",n-r->n-r,n-r,n-r,Scaled Abuse_Hacking,Legal Action,Facebook,https://arynews.tv/fia-busts-gang-hacking-girls-facebook-accounts/,,,,,
1609,YouTube aims to fight fake news with links to the real thing,"(Fighting fake news is an online arms race, irish examiner, 2018-07-12)","(Fighting fake news is an online arms race, irish examiner, 2018-07-12)",n-r->n-r,n-r,n-r,Scaled Abuse_Inauthentic Behavior,Social Media Policy Change,Online,https://www.irishexaminer.com/opinion/commentanalysis/arid-30854545.html,,,,,
8782,Russia's YouTube' still down after cyber-attack,"(Russian TV, online platforms hacked with antiwar message on Victory Day, the washington post, 2022-05-09)","(Russian TV, online platforms hacked with antiwar message on Victory Day, the washington post, 2022-05-09)",n-r->n-i,n-r,n-i,Scaled Abuse_Hacking,,"SmartTV, Yandex, Rutube",https://www.washingtonpost.com/world/2022/05/09/russia-tv-hack-victory-day-ukraine-war/,,,,,
4399,2 out of 5 Koreans cannot recognize fake news,"(Soldiers in a War on Fake News, new york times, 2018-10-10), (Gov't to unveil measures to crack down on fake news this month, the korea times, 2018-10-10), (S Korea police probe 'fake news' on North, bbc monitoring asia pacific, 2018-10-11), (Brazil battles fake news 'tsunami' amid polarized presidential election, the guardian, 2018-10-10), (Jimmy Kimmel on Trump’s op-ed: ‘He was in the fake news’, the guardian, 2018-10-11)","(Soldiers in a War on Fake News, new york times, 2018-10-10)",n-r->n-r,n-r,n-r,Scaled Abuse_Inauthentic Behavior,Protective Measures,Facebook,https://www.nytimes.com/2018/10/09/business/facebook-philippines-rappler-fake-news.html,,,,,
56380,Sony asks media to destroy records; Studio's lawyer calls leaked documents 'stolen' in an attempt to suppress coverage.,"(Sony demands news media delete data obtained by hackers, international new york times, 2014-12-16), (Sony warns US media not to use data from cyber hacking, irish times, 2014-12-16), (Hackers Release Emails from Account of Sony Entertainment's Michael Lynton; Threats Made to Theaters Showing Sony Movie 'The Interview', wall street journal, 2014-12-16), (Sony Demands Media Delete Data Revealed by Hackers, new york times, 2014-12-15), (Sony Tells Media Not to Use Leaked Documents; Movie Studio Hires Lawyer David Boies to Help Put a Lid on Information Spilled by Hackers, wall street journal, 2014-12-15), (Sony warns media not to use leaked data, the straits times, 2014-12-16)","(Sony demands news media delete data obtained by hackers, international new york times, 2014-12-16)",n-r->1-i,n-r,1-i,Scaled Abuse_Hacking,Protective Measures,Sony,https://www.nytimes.com/2014/12/15/business/sony-pictures-demands-that-news-organizations-delete-stolen-data.html,,,,,
12660,Trump retweets far-right British commentator praising his attacks on Omar,"(The London police Twitter feed was hacked. Then Trump got in on the act., the washington post, 2019-07-20), (The London Police Twitter feed was hacked. Then Trump got in on the act., the washington post, 2019-07-20), (Twitter account of London's Metropolitan Police hacked, dpa international (english), 2019-07-20), (Scotland Yard's Twitter account breached in series of bizarre posts, the guardian, 2019-07-22), (‘What You Gonna Do Phone the Police?’ London Police Twitter Is Hacked, new york times, 2019-07-19), (Crackdown on illegal building after social media complaints, the times of india, 2019-07-22), (Trump’s racist tweets were not a ‘love it or leave it’ argument, the washington post, 2019-07-22), (‘He always doubles down’: Inside the political crisis caused by Trump’s racist tweets, the washington post, 2019-07-20), (Why didn’t more congressional Republicans condemn Trump’s racist tweets about the ‘Squad’? This graph explains., the washington post, 2019-07-20), (‘Racially charged’: Reuters is struggling with descriptions of Trump’s racist tweets, the washington post, 2019-07-22), (Prove the Tweets Were Racist; The media undertakes Mission Impossible in trying to categorize Trump statements., wall street journal, 2019-07-23)","(The London police Twitter feed was hacked. Then Trump got in on the act., the washington post, 2019-07-20)",n-r->1-i,n-r,1-i,Scaled Abuse_Hacking,Remove Content,Twitter,https://www.washingtonpost.com/world/2019/07/20/london-police-twitter-feed-was-hacked-then-trump-got-act/,해킹해서 계정 이름으로 이상한 게시물 업로드 -> impersonation과 비슷한 양상,,,,
36136,Anupama Parameswaran upset with morphed photo and hacked account,"(Anupama Parameswaran's Facebook account gets hacked; the actress slams the hacker for morphing her photos, the times of india, 2020-04-13)",Anupama Parameswaran’s Facebook account gets hacked; the actress slams the hacker for morphing her photos,n-r->1-i,n-r,1-i,Scaled Abuse_Hacking,,Facebook,https://timesofindia.indiatimes.com/entertainment/malayalam/movies/news/anupama-parameswarans-facebook-account-gets-hacked-the-actress-slams-the-hacker-for-morphing-her-photos/articleshow/75105063.cms,"The actress advised the hackers to use their brains for something productive. The actress initially informed her fans that her Facebook account was hacked. “Some idiot has hacked my account...just alerting,” she wrote.",,,,
60321,Smart phones undermining parental tabs on internet use,"('Smart phones undermining parental tabs on internet use', 'the daily telegraph', '2011-04-11')",Average Twitter users may receive up to 17 'dangerous' Tweets per day,n-r->n-r,n-r,n-r,Scaled Abuse_Spam,,Twitter,,,,,,
45178,"India's curbs on Kashmir internet, media draw UN flak","(Net-Neutrality Debate Gets Nastier Online, wall street journal, 2017-05-12)","Bots, Denial of Service Are Latest Weapons in Net Neutrality Battle",n-r->n-r,n-r,n-r,Scaled Abuse_Inauthentic Behavior,,Online,https://www.wsj.com/articles/bots-denial-of-service-are-latest-weapons-in-net-neutrality-battle-1494533379,print edition as 'Net-Neutrality Debate Gets Nastier Online',"허위 이름 사용, 봇 계정 활동",,,
